{
  "canonical_account_id": "acc_singtel_001",
  "engagement_id": "eng_20260328_090500",
  "engagement_type": "OPPORTUNITY",
  "engagement_timestamp": "2026-03-28T09:05:00Z",
  "channel": "salesforce_crm",
  "related_product_id": "prd_sgt_001",
  "related_brand_id": "brand_singtel",
  "related_opportunity_id": "006xx00000SGT001",
  "engagement_score": 86,
  "run_id": "run_public_regional_20260328",
  "run_timestamp": "2026-03-28T09:00:00Z",
  "model_version": "dc-canonical-v2.1.0"
}
